<?xml version="1.0" encoding="UTF-8"?>
<!-- edited with XML Spy v4.4 U (http://www.xmlspy.com) by jmv (.) -->

<XmlLibrary xmlns="http://www.iknow.pt/XmlLibrary" xmlns:xsi="http://www.w3.org/2001/XMLSchema-instance"
	xsi:schemaLocation="http://www.iknow.pt/XmlLibrary ../schemas/xmllibrary.xsd">
	<name>Geocode</name>
	<version>1.0</version>
	<author>Uniksystem</author>
	<description>Geocode</description>
	<i18nName>library.geocode.name</i18nName>
	<i18nDescription>library.geocode.description</i18nDescription>

	<XmlBlock>
		<class>BlockGeocode</class>
		<XmlPort>
			<name>portIn</name>
			<description>Entrada</description>
			<in_out>in</in_out>
			<position>
				<x>-5</x>
				<y>25</y>
			</position>
		</XmlPort>
		<XmlPort>
			<name>portSuccess</name>
			<description>Sucesso</description>
			<in_out>out</in_out>
			<position>
				<x>102</x>
				<y>15</y>
			</position>
		</XmlPort>
		<XmlPort>
			<name>portError</name>
			<description>Erro</description>
			<in_out>out</in_out>
			<position>
				<x>102</x>
				<y>45</y>
			</position>
		</XmlPort>
		<XmlAttribute>
			<name>inputMorada</name>
			<description>Input morada</description>
			<value />
		</XmlAttribute>
		<XmlAttribute>
			<name>outputCoordenadas</name>
			<description>Output lista de coordenadas</description>
			<value />
		</XmlAttribute>
		<image>bpmn_task.png</image>
		<description>BlockGeocode</description>
		<i18n>library.geocode.block.geocode</i18n>
	</XmlBlock>
	
	
</XmlLibrary>
