<?xml version="1.0" encoding="UTF-8"?>
<!-- edited with XML Spy v4.4 U (http://www.xmlspy.com) by jmv (.) -->

<XmlLibrary xmlns="http://www.iknow.pt/XmlLibrary"
	xmlns:xsi="http://www.w3.org/2001/XMLSchema-instance"
	xsi:schemaLocation="http://www.iknow.pt/XmlLibrary ../schemas/xmllibrary.xsd">
	<name>Básica</name>
	<version>1.0</version>
	<author>iKnow</author>
	<description>Básica</description>
	<XmlBlock>
		<class>BlockStart</class>
		<XmlPort>
			<name>portOut</name>
			<description>Start</description>
			<in_out>out</in_out>
			<position>
				<x>55</x>
				<y>25</y>
			</position>
		</XmlPort>
		<image>start.png</image>
		<className>pt.iknow.floweditor.blocks.AlteraAtributosStart</className>
		<description>Início</description>
		<automatic>true</automatic>
	</XmlBlock>
	<XmlBlock>
		<class>BlockEnd</class>
		<XmlPort>
			<name>portIn</name>
			<description>End</description>
			<in_out>in</in_out>
			<position>
				<x>-5</x>
				<y>25</y>
			</position>
		</XmlPort>
		<XmlAttribute>
			<name>UserMessage</name>
			<description>User Message</description>
			<value></value>
		</XmlAttribute>
		<image>stop.png</image>
		<description>Fim</description>
	</XmlBlock>
	<XmlBlock>
		<class>BlockFormulario</class>
		<XmlPort>
			<name>portIn</name>
			<description>portIn</description>
			<in_out>in</in_out>
			<position>
				<x>-5</x>
				<y>25</y>
			</position>
		</XmlPort>
		<XmlPort>
			<name>portFront</name>
			<description>portFront</description>
			<in_out>out</in_out>
			<position>
				<x>55</x>
				<y>25</y>
			</position>
		</XmlPort>
		<XmlPort>
			<name>portEvent</name>
			<description>portEvent</description>
			<in_out>out</in_out>
			<position>
				<x>25</x>
				<y>55</y>
			</position>
		</XmlPort>
		<image>formulario.png</image>
		<className>pt.iknow.floweditor.blocks.AlteraAtributosJSP</className>
		<description>Formulário</description>
	</XmlBlock>
	<XmlBlock>
		<class>BlockCopia</class>
		<XmlPort>
			<name>portIn</name>
			<description>portIn</description>
			<in_out>in</in_out>
			<position>
				<x>-5</x>
				<y>25</y>
			</position>
		</XmlPort>
		<XmlPort>
			<name>portOut</name>
			<description>portOut</description>
			<in_out>out</in_out>
			<position>
				<x>55</x>
				<y>25</y>
			</position>
		</XmlPort>
		<image>copia.png</image>
		<className>pt.iknow.floweditor.blocks.AlteraAtributosCopia</className>
		<description>Atribuição</description>
	</XmlBlock>
	<XmlBlock>
		<class>BlockCondicao</class>
		<XmlPort>
			<name>portIn</name>
			<description>portIn</description>
			<in_out>in</in_out>
			<position>
				<x>-5</x>
				<y>25</y>
			</position>
		</XmlPort>
		<XmlPort>
			<name>portTrue</name>
			<description>portTrue</description>
			<in_out>out</in_out>
			<position>
				<x>55</x>
				<y>10</y>
			</position>
		</XmlPort>
		<XmlPort>
			<name>portFalse</name>
			<description>portFalse</description>
			<in_out>out</in_out>
			<position>
				<x>55</x>
				<y>40</y>
			</position>
		</XmlPort>
		<XmlAttribute>
			<name>condition</name>
			<description>Condição</description>
			<value />
		</XmlAttribute>
		<image>condicao.png</image>
		<description>Condição</description>
	</XmlBlock>
	<XmlBlock>
		<class>BlockMultiCondition</class>
		<XmlPort>
			<name>portIn</name>
			<description>portIn</description>
			<in_out>in</in_out>
			<position>
				<x>-5</x>
				<y>25</y>
			</position>
		</XmlPort>
		<XmlPort>
			<name>portTrueC1</name>
			<description>portTrueC1</description>
			<in_out>out</in_out>
			<position>
				<x>55</x>
				<y>5</y>
			</position>
		</XmlPort>
		<XmlPort>
			<name>portTrueC2</name>
			<description>portTrueC2</description>
			<in_out>out</in_out>
			<position>
				<x>55</x>
				<y>15</y>
			</position>
		</XmlPort>
		<XmlPort>
			<name>portTrueC3</name>
			<description>portTrueC3</description>
			<in_out>out</in_out>
			<position>
				<x>55</x>
				<y>25</y>
			</position>
		</XmlPort>
		<XmlPort>
			<name>portTrueC4</name>
			<description>portTrueC1</description>
			<in_out>out</in_out>
			<position>
				<x>55</x>
				<y>35</y>
			</position>
		</XmlPort>
		<XmlPort>
			<name>portFalse</name>
			<description>portFalse</description>
			<in_out>out</in_out>
			<position>
				<x>55</x>
				<y>50</y>
			</position>
		</XmlPort>
		<XmlAttribute>
			<name>condition0</name>
			<description>Se</description>
			<value />
		</XmlAttribute>
		<XmlAttribute>
			<name>condition1</name>
			<description>Senão, Verifica Se</description>
			<value></value>
		</XmlAttribute>
		<XmlAttribute>
			<name>condition2</name>
			<description>Senão, Verifica Se</description>
			<value></value>
		</XmlAttribute>
		<XmlAttribute>
			<name>condition3</name>
			<description>Senão, Verifica Se</description>
			<value></value>
		</XmlAttribute>
		<image>condicao.png</image>
		<description>MultiCondition</description>
		<i18n>Multiplas Condições</i18n>
	</XmlBlock>
	<XmlBlock>
		<class>BlockValidacoes</class>
		<XmlPort>
			<name>portIn</name>
			<description>portIn</description>
			<in_out>in</in_out>
			<position>
				<x>-5</x>
				<y>25</y>
			</position>
		</XmlPort>
		<XmlPort>
			<name>portOutError</name>
			<description>portOutError</description>
			<in_out>out</in_out>
			<position>
				<x>55</x>
				<y>40</y>
			</position>
		</XmlPort>
		<XmlPort>
			<name>portOutOk</name>
			<description>portOutOk</description>
			<in_out>out</in_out>
			<position>
				<x>55</x>
				<y>10</y>
			</position>
		</XmlPort>
		<image>validacoes.png</image>
		<className>pt.iknow.floweditor.blocks.AlteraAtributosValidacoes</className>
		<description>Validações</description>
  </XmlBlock>
  <!-- disabled for now XmlBlock>
    <class>BlockWebForm</class>
		<XmlPort>
			<name>portIn</name>
			<description>portIn</description>
			<in_out>in</in_out>
			<position>
				<x>-5</x>
				<y>25</y>
			</position>
		</XmlPort>
		<XmlPort>
			<name>portFront</name>
			<description>portFront</description>
			<in_out>out</in_out>
			<position>
				<x>55</x>
				<y>25</y>
			</position>
		</XmlPort>
		<XmlPort>
			<name>portEvent</name>
			<description>portEvent</description>
			<in_out>out</in_out>
			<position>
				<x>25</x>
				<y>55</y>
			</position>
		</XmlPort>
    <image>formulario.png</image>
    <className>pt.iknow.floweditor.blocks.AlteraAtributosWebForm</className>
    <description>Formulário Web (beta)</description>
  </XmlBlock-->
</XmlLibrary>
