<?xml version="1.0" encoding="UTF-8"?>
	<!-- edited with XML Spy v4.4 U (http://www.xmlspy.com) by jmv (.) -->

<XmlLibrary xmlns="http://www.iknow.pt/XmlLibrary" xmlns:xsi="http://www.w3.org/2001/XMLSchema-instance"
	xsi:schemaLocation="http://www.iknow.pt/XmlLibrary ../schemas/xmllibrary.xsd">
	<name>Basic</name>
	<version>1.0</version>
	<author>iKnow</author>
	<description>Basic</description>
	<i18nName>library.basic.name</i18nName>
	<i18nDescription>library.basic.description</i18nDescription>
	<XmlBlock>
		<class>BlockStart</class>
		<XmlPort>
			<name>portOut</name>
			<description>Start</description>
			<in_out>out</in_out>
			<position>
				<x>50</x>
				<y>25</y>
			</position>
		</XmlPort>
		<image>bpmn_start.png</image>
		<className>pt.iknow.floweditor.blocks.AlteraAtributosStart</className>
		<description>Start</description>
		<i18n>library.basic.block.start</i18n>
		<automatic>true</automatic>
	</XmlBlock>
	<XmlBlock>
		<class>BlockEnd</class>
		<XmlPort>
			<name>portIn</name>
			<description>End</description>
			<in_out>in</in_out>
			<position>
				<x>-2</x>
				<y>25</y>
			</position>
		</XmlPort>
		<XmlAttribute>
			<name>UserMessage</name>
			<description>User Message</description>
			<value></value>
		</XmlAttribute>
		<image>bpmn_end.png</image>
		<description>End</description>
		<i18n>library.basic.block.end</i18n>
	</XmlBlock>
	<XmlBlock>
		<class>BlockEnd</class>
		<XmlPort>
			<name>portIn</name>
			<description>End</description>
			<in_out>in</in_out>
			<position>
				<x>-2</x>
				<y>20</y>
			</position>
		</XmlPort>
		<XmlAttribute>
			<name>UserMessage</name>
			<description>User Message</description>
			<value></value>
		</XmlAttribute>
		<image>bpmn_end_message.png</image>
		<description>End</description>
		<i18n>library.basic.block.end</i18n>
	</XmlBlock>
  <XmlBlock>
    <class>BlockBeanShell</class>
   <XmlPort>
      <name>portIn</name>
      <description>portIn</description>
      <in_out>in</in_out>
      <position>
        <x>-5</x>
        <y>27</y>
      </position>
    </XmlPort>
    <XmlPort>
      <name>portOut</name>
      <description>portOut</description>
      <in_out>out</in_out>
      <position>
        <x>105</x>
        <y>15</y>
      </position>
    </XmlPort>
    <XmlPort>
      <name>portError</name>
      <description>portError</description>
      <in_out>out</in_out>
      <position>
        <x>105</x>
        <y>45</y>
      </position>
    </XmlPort>
    <className>pt.iknow.floweditor.blocks.AlteraAtributosBeanShell</className>
    <image>bpmn_task.png</image>
    <description>Task</description>
    <i18n>library.utils.block.bsh</i18n>
  </XmlBlock>
  <XmlBlock>
    <class>BlockSubFlow</class>
    <className>pt.iknow.floweditor.blocks.AlteraAtributosSubFlow</className>
    <XmlPort>
      <name>portIn</name>
      <description>Entrada</description>
      <in_out>in</in_out>
      <position>
        <x>-5</x>
        <y>27</y>
      </position>
    </XmlPort>
    <XmlPort>
      <name>portSuccess</name>
      <description>Sucesso</description>
      <in_out>out</in_out>
      <position>
        <x>105</x>
        <y>27</y>
      </position>
    </XmlPort>
    <image>bpmn_subprocess.png</image>
    <description>Subprocess</description>
    <i18n>library.utils.block.subflow</i18n>
  </XmlBlock>
	<XmlBlock>
		<class>BlockCondicao</class>
		<XmlPort>
			<name>portIn</name>
			<description>portIn</description>
			<in_out>in</in_out>
			<position>
				<x>-2</x>
				<y>30</y>
			</position>
		</XmlPort>
		<XmlPort>
			<name>portTrue</name>
			<description>portTrue</description>
			<in_out>out</in_out>
			<position>
				<x>62</x>
				<y>15</y>
			</position>
		</XmlPort>
		<XmlPort>
			<name>portFalse</name>
			<description>portFalse</description>
			<in_out>out</in_out>
			<position>
				<x>62</x>
				<y>45</y>
			</position>
		</XmlPort>
		<XmlAttribute>
			<name>condition</name>
			<description>Condition</description>
			<value />
		</XmlAttribute>
		<image>bpmn_gateway_exclusive.png</image>
		<description>Condition</description>
		<i18n>library.basic.block.condition</i18n>
	</XmlBlock>
		<XmlBlock>
		<class>BlockMultiCondition</class>
		<XmlPort>
			<name>portIn</name>
			<description>portIn</description>
			<in_out>in</in_out>
			<position>
				<x>-5</x>
				<y>25</y>
			</position>
		</XmlPort>
		<XmlPort>
			<name>portTrueC1</name>
			<description>portTrueC1</description>
			<in_out>out</in_out>
			<position>
				<x>55</x>
				<y>5</y>
			</position>
		</XmlPort>
		<XmlPort>
			<name>portTrueC2</name>
			<description>portTrueC2</description>
			<in_out>out</in_out>
			<position>
				<x>55</x>
				<y>15</y>
			</position>
		</XmlPort>
		<XmlPort>
			<name>portTrueC3</name>
			<description>portTrueC3</description>
			<in_out>out</in_out>
			<position>
				<x>55</x>
				<y>25</y>
			</position>
		</XmlPort>
		<XmlPort>
			<name>portTrueC4</name>
			<description>portTrueC1</description>
			<in_out>out</in_out>
			<position>
				<x>55</x>
				<y>35</y>
			</position>
		</XmlPort>
		<XmlPort>
			<name>portFalse</name>
			<description>portFalse</description>
			<in_out>out</in_out>
			<position>
				<x>55</x>
				<y>50</y>
			</position>
		</XmlPort>
		<XmlAttribute>
			<name>condition0</name>
			<description>Se</description>
			<value />
		</XmlAttribute>
		<XmlAttribute>
			<name>condition1</name>
			<description>Senão, Verifica Se</description>
			<value></value>
		</XmlAttribute>
		<XmlAttribute>
			<name>condition2</name>
			<description>Senão, Verifica Se</description>
			<value></value>
		</XmlAttribute>
		<XmlAttribute>
			<name>condition3</name>
			<description>Senão, Verifica Se</description>
			<value></value>
		</XmlAttribute>
		<image>condicao.png</image>
		<description>MultiCondition</description>
		<i18n>library.basic.block.multi_condition</i18n>
	</XmlBlock>
  <XmlBlock>
    <class>BlockBifurcacao</class>
    <XmlPort>
      <name>portIn</name>
      <description>portIn</description>
      <in_out>in</in_out>
      <position>
        <x>-2</x>
        <y>30</y>
      </position>
    </XmlPort>
    <XmlPort>
      <name>portOut</name>
      <description>portOut</description>
      <in_out>out</in_out>
      <position>
        <x>62</x>
        <y>15</y>
      </position>
    </XmlPort>
    <XmlPort>
      <name>portSubProc</name>
      <description>portSubProc</description>
      <in_out>out</in_out>
      <position>
        <x>62</x>
        <y>45</y>
      </position>
    </XmlPort>
    <image>bpmn_gateway_paralel.png</image>
    <description>Fork</description>
    <i18n>library.utils.block.fork</i18n>
  </XmlBlock>
  <XmlBlock>
    <class>BlockSincronizacao</class>
    <XmlPort>
      <name>portIn</name>
      <description>portIn</description>
      <in_out>in</in_out>
      <position>
        <x>-2</x>
        <y>15</y>
      </position>
    </XmlPort>
    <XmlPort>
      <name>portInSubProc</name>
      <description>portInSubProc</description>
      <in_out>in</in_out>
      <position>
        <x>-2</x>
        <y>45</y>
      </position>
    </XmlPort>
    <XmlPort>
      <name>portOut</name>
      <description>portOut</description>
      <in_out>out</in_out>
      <position>
        <x>62</x>
        <y>30</y>
      </position>
    </XmlPort>
    <className>pt.iknow.floweditor.blocks.AlteraAtributosSincronizacao</className>
    <image>bpmn_gateway_paralel.png</image>
    <description>Join</description>
    <i18n>library.utils.block.sync</i18n>
  </XmlBlock>
  <XmlBlock>
    <class>BlockJuncaoExclusiva</class>
    <XmlPort>
      <name>portIn</name>
      <description>portIn</description>
      <in_out>in</in_out>
      <position>
        <x>-2</x>
        <y>15</y>
      </position>
    </XmlPort>
    <XmlPort>
      <name>portInSubProc</name>
      <description>portInSubProc</description>
      <in_out>in</in_out>
      <position>
        <x>-2</x>
        <y>45</y>
      </position>
    </XmlPort>
    <XmlPort>
      <name>portOut</name>
      <description>portOut</description>
      <in_out>out</in_out>
      <position>
        <x>62</x>
        <y>30</y>
      </position>
    </XmlPort>
    <image>bpmn_gateway_exclusive.png</image>
    <description>Merge</description>
    <i18n>library.utils.block.merge</i18n>
  </XmlBlock>
</XmlLibrary>
